period,segment_id,segment_name,price_min_vnd_m2,price_max_vnd_m2,area_note,total_price_note
2026-07,nong-nghiep-dien-tich-lon,Đất nông nghiệp diện tích lớn,1700000,2800000,"Từ 2.000 m² trở lên, chưa tách thửa","Tổng giá phổ biến 4,5–15 tỷ đồng"
2026-07,tach-thua-tho-cu,"Khu tách thửa nhỏ, có thổ cư",3000000,4500000,"Thường 150–300 m², có một phần thổ cư","Tổng giá phổ biến 500 triệu – 1,2 tỷ đồng"
2026-07,view-doi-view-ho,"Đặc biệt — view đồi, view hồ",4000000,6000000,"Tầm nhìn ra hồ hoặc view cao thoáng","Tổng giá phổ biến 1,2–1,8 tỷ đồng/lô"
2026-06,nong-nghiep-dien-tich-lon,Đất nông nghiệp diện tích lớn,1700000,2800000,,
2026-06,tach-thua-tho-cu,"Khu tách thửa nhỏ, có thổ cư",3000000,4500000,,
2026-06,view-doi-view-ho,"Đặc biệt — view đồi, view hồ",4000000,6000000,,
